{
  "developerAdoptionSurfaceId": "developeradoptionsurface-001",
  "generatedAt": "2026-06-10T10:05:00Z",
  "surfaceStatus": "local_mvp_adoption_ready",
  "audience": [
    "developer",
    "agent",
    "mcp_host",
    "maintainer"
  ],
  "bindings": {
    "releaseManifestId": "releasemanifest-001",
    "mvpRunbookPath": "spec/mvp-local-runtime.md",
    "localSourceRuntimeId": "localsourceruntime-001",
    "forecastId": "forecast-1102",
    "questionId": "question-1102",
    "forecastCardId": "forecastcard-forecast-1102",
    "forecastBundleId": "forecastbundle-forecast-1102"
  },
  "quickstart": [
    {
      "stepId": "adoptionquickstart-001",
      "order": 1,
      "title": "Start with the external-agent front door",
      "command": "python3 scripts/ope.py agent-implementation-kit --view quickstart",
      "expected": "The agent implementation kit returns the shortest safe sequence for adding an OPE-backed prediction feature.",
      "timeBudgetSeconds": 20
    },
    {
      "stepId": "adoptionquickstart-002",
      "order": 2,
      "title": "Confirm Python runtime",
      "command": "python3 --version",
      "expected": "Python 3.12+ is preferred; the repository uses only the standard library.",
      "timeBudgetSeconds": 20
    },
    {
      "stepId": "adoptionquickstart-003",
      "order": 3,
      "title": "Run the local check suite",
      "command": "python3 scripts/run_checks.py",
      "expected": "All schema, fixture, read-surface, agent, and release checks pass without live network access.",
      "timeBudgetSeconds": 900
    },
    {
      "stepId": "adoptionquickstart-004",
      "order": 4,
      "title": "Inspect approved local-folder runtime",
      "command": "python3 scripts/ope.py local-source-runtime",
      "expected": "The approved local-folder case binds to forecast-1102 and blocked examples remain non-generating.",
      "timeBudgetSeconds": 30
    },
    {
      "stepId": "adoptionquickstart-005",
      "order": 5,
      "title": "Read the first forecast card",
      "command": "python3 scripts/ope.py read --record-type forecast-card --id forecast-1102 --question-id question-1102",
      "expected": "A compact forecast card is available with probability, baseline, setup binding, and claim warning.",
      "timeBudgetSeconds": 20
    },
    {
      "stepId": "adoptionquickstart-006",
      "order": 6,
      "title": "Read the lifecycle bundle",
      "command": "python3 scripts/ope.py read --record-type forecast-bundle --id forecast-1102 --question-id question-1102",
      "expected": "The bundle links question, evidence, forecast artifact, history, resolution, scoring, and setup bindings.",
      "timeBudgetSeconds": 20
    },
    {
      "stepId": "adoptionquickstart-007",
      "order": 7,
      "title": "Inspect the claim boundary",
      "command": "python3 scripts/ope.py transit-track-record-gate",
      "expected": "The public transport gate remains below track-record and calibration thresholds.",
      "timeBudgetSeconds": 20
    },
    {
      "stepId": "adoptionquickstart-008",
      "order": 8,
      "title": "Evaluate recurring campaign readiness",
      "command": "python3 scripts/ope.py prediction-campaign explain",
      "expected": "The campaign explain readback names the next forecast, next resolution, evidence threshold, and claim boundary before hosted scheduling work.",
      "timeBudgetSeconds": 30
    }
  ],
  "exampleScenario": {
    "scenarioId": "adoptionscenario-100",
    "title": "Approved Local Source To Forecast Readback",
    "goal": "Reach a valid forecast card and lifecycle bundle from the checked local MVP while preserving source, method, resolution, scoring, and claim boundaries.",
    "steps": [
      {
        "stepId": "adoptionscenario-001",
        "phase": "source_setup",
        "command": "python3 scripts/ope.py private-setup-orchestrator --case local_file_confirmed",
        "expectedStatus": "completed_forecast_readback",
        "forecastId": "forecast-1102",
        "questionId": "question-1102",
        "createsArtifacts": false,
        "qualityClaimAllowed": false
      },
      {
        "stepId": "adoptionscenario-002",
        "phase": "runtime_gate",
        "command": "python3 scripts/ope.py local-source-runtime --case approved_local_folder",
        "expectedStatus": "forecast_card_ready",
        "forecastId": "forecast-1102",
        "questionId": "question-1102",
        "createsArtifacts": false,
        "qualityClaimAllowed": false
      },
      {
        "stepId": "adoptionscenario-003",
        "phase": "forecast_readback",
        "command": "python3 scripts/ope.py read --record-type forecast-card --id forecast-1102 --question-id question-1102",
        "expectedStatus": "available",
        "forecastId": "forecast-1102",
        "questionId": "question-1102",
        "createsArtifacts": false,
        "qualityClaimAllowed": false
      },
      {
        "stepId": "adoptionscenario-004",
        "phase": "lifecycle_bundle",
        "command": "python3 scripts/ope.py read --record-type forecast-bundle --id forecast-1102 --question-id question-1102",
        "expectedStatus": "available",
        "forecastId": "forecast-1102",
        "questionId": "question-1102",
        "createsArtifacts": false,
        "qualityClaimAllowed": false
      },
      {
        "stepId": "adoptionscenario-005",
        "phase": "resolution_scoring",
        "command": "python3 scripts/ope.py agent-call --operation scoring_summary --forecast-id forecast-1102 --question-id question-1102",
        "expectedStatus": "ok",
        "forecastId": "forecast-1102",
        "questionId": "question-1102",
        "createsArtifacts": false,
        "qualityClaimAllowed": false
      },
      {
        "stepId": "adoptionscenario-006",
        "phase": "claim_review",
        "command": "python3 scripts/ope.py transit-track-record-gate",
        "expectedStatus": "not_enough_resolved_comparable_outcomes",
        "forecastId": "forecast-1102",
        "questionId": "question-1102",
        "createsArtifacts": false,
        "qualityClaimAllowed": false
      }
    ],
    "expectedFinalState": {
      "forecastId": "forecast-1102",
      "questionId": "question-1102",
      "forecastCardAvailable": true,
      "lifecycleBundleAvailable": true,
      "resolutionStatus": "resolved",
      "scoreStatus": "scored",
      "qualityClaimAllowed": false
    }
  },
  "integrationNotes": [
    {
      "interface": "cli",
      "implementedStatus": "implemented_local",
      "minimumInput": "A local shell with Python and repository files.",
      "exampleCommand": "python3 scripts/ope.py local-source-runtime",
      "expectedOutput": "JSON summary or one section/case with checked IDs, statuses, commands, and claim boundaries.",
      "boundary": "CLI commands are local and deterministic by default; live probes remain explicit opt-in commands."
    },
    {
      "interface": "agent_call",
      "implementedStatus": "implemented_local",
      "minimumInput": "Operation name plus IDs such as forecastId=forecast-1102 and questionId=question-1102.",
      "exampleCommand": "python3 scripts/ope.py agent-call --operation forecast_card --forecast-id forecast-1102 --question-id question-1102",
      "expectedOutput": "One transport-neutral envelope with status, exitCode, recordBinding, payload, and sanitized errors.",
      "boundary": "Agent-call is a local dispatcher, not a hosted API or production protocol service; campaign readbacks must be evaluated before hosted scheduling."
    },
    {
      "interface": "mcp_stdio",
      "implementedStatus": "local_scaffold",
      "minimumInput": "An MCP-capable host that can launch python3 scripts/ope.py mcp-stdio.",
      "exampleCommand": "python3 scripts/ope.py mcp-stdio",
      "expectedOutput": "MCP tools expose the same local dispatcher envelope semantics over stdio.",
      "boundary": "The MCP adapter is local stdio only; HTTP and queue adapters remain future protocol mappings."
    }
  ],
  "releaseNotes": [
    {
      "category": "implemented",
      "items": [
        "Local CLI checks, readbacks, forecast cards, lifecycle bundles, and generated record validation.",
        "Approved local-folder source runtime for checked CSV/JSON fixture files under path and size limits.",
        "Transport-neutral agent-call envelopes and local MCP stdio scaffold over the same dispatcher.",
        "Resolution, scoring, source-handoff, setup method, source-quality, usage-trace, and pilot-validation readbacks.",
        "Repeating prediction campaign explain, adapter, MCP, and pilot task readbacks for local campaign comprehension."
      ]
    },
    {
      "category": "fixture_only",
      "items": [
        "Weather-logistics source-handoff forecast, resolution, and scoring remain checked fixture-mode paths.",
        "Public transport corpus growth, method options, track-record gates, and live evidence promotion remain below claim thresholds.",
        "Usage traces and pilot summaries are synthetic checked examples, not real hosted telemetry.",
        "Recurring campaign events are checked local readbacks and do not create hosted schedules or production watchers."
      ]
    },
    {
      "category": "non_goal",
      "items": [
        "No hosted service, network API, production SDK, or production agent adapter runtime is implemented.",
        "No arbitrary private API/database parsing, credential storage, raw private-row retention, or hosted watcher exists.",
        "No calibration, broad forecast-quality, or production connector claim is allowed from the current examples.",
        "No generated language-specific runtime types are included before adoption evidence shows they reduce setup friction.",
        "No hosted scheduling or broader private-source runtime should be promoted before recurring prediction setup is evaluated."
      ]
    }
  ],
  "typeGenerationDecision": {